A bird is smaller than a dog.,A bird is (smaller/smallest) than a dog.
Jogging is faster than walking.,Jogging is (faster/fastest) than walking.
Your house is the biggest on your street.,Your house is the (bigger/biggest) on your street.
Flying in an airplane is the fastest type of transportation.,Flying in an airplane is the (faster/fastest) type of transportation.
That book was the best book we have ever read.,That book was the (better/best) book we have ever read.
Summer is warmer than winter.,Summer is (warmer/warmest) than winter.
He had the worst cold ever.,He had the (worse/worst) cold ever.
She makes the best cake in the world.,She makes the (better/best) cake in the world.