A bird is smaller than a dog.,A bird is (smaller/smallest) than a dog.
The hardest natural rock is diamond.,The (harder/hardest) natural rock is diamond.
She makes the best cake in the world.,She makes the (better/best) cake in the world.
His worst enemy is himself.,His (worse/worst) enemy is himself.
The faster path is selected.,The (faster/fastest) path is selected.
Blue whale is the biggest animal in the world.,Blue whale is the (bigger/biggest) animal in the world.
Flying in an airplane is the fastest type of transportation.,Flying in an airplane is the (faster/fastest) type of transportation.
Summer is warmer than winter.,Summer is (warmer/warmest) than winter.
